{
  "id": "vertical-short",
  "name": "Short vertical (Reels/Shorts/TikTok)",
  "width": 1080,
  "height": 1920,
  "aspect": "9:16",
  "fps": 30,
  "duration_range_s": [
    6,
    30
  ],
  "safe_zone": {
    "top": 0.12,
    "bottom": 0.22,
    "side": 0.07
  },
  "notes": "UI da plataforma cobre topo e rodapé: texto importante dentro da zona segura. Hook no primeiro segundo; funciona sem som. Mesmos valores de M.safe(W,H) no motion-kit."
}
